345,SEPC/03/04/3579/2018-19,Institutional/Corporate Members ,Lupin Limited ,391156853,"Kalpataru Inspire 3rd Floor Off., Western Express Highway Santacruz E Mumbai -400055 (Maharashtra",Maharashtra,31-03-2019,"Kalpataru Inspire 3rd Floor Off., Western Express Highway Santacruz E Mumbai -400055 (Maharashtra",Mr. Venkatesh Pai,Dy. General Manager,022-66402034,venkateshpai@lupin.com,Consultancy Services ,,
346,SEPC/02/03/3583/2018-19,Individual Ordinary Members  ,1st And Ten Productions,AAEPV3392A,"Sea View 100, A-A Bhulabhai Desai Road Cumballa Hill Mumbai-400026 (Maharashtra)",Maharashtra,31-03-2019,"Sea View 100, A-A Bhulabhai Desai Road Cumballa Hill Mumbai-400026 (Maharashtra)",Mr. Rajeev Virani,Proprietor,9820070521,rajeevvirani@gmail.com,Entertainment services including Audio-visual Services,,
347,SEPC/03/11/3586/2018-19,Institutional/Corporate Members ,Pulse Secure Technologies (India) Private Limited ,314043268,5th Floor Paville House Off. Veer Savarkar Marg Prabhadevi Mumbai -400025 (Maharashtra),Maharashtra,31-03-2019,5th Floor Paville House Off. Veer Savarkar Marg Prabhadevi Mumbai -400025 (Maharashtra),Mr. Yogi Sadana,Group Chief Financial Officer,"022-71774000
09096812338",ys@aeriestechnology.com,Marketing Research and Public Opinion Polling Services/Management Services  ,,
348,SEPC/03/04/3593/2018-19,Institutional/Corporate Members ,Creditcheck Partners Private Limited ,316521698,"Unit No. 104, Shah & Nahar Indl Estate ,Dr Emoses Road Worli Mumbai -400018 (Maharashtra)",Maharashtra,31-03-2019,"Unit No. 104, Shah & Nahar Indl Estate ,Dr Emoses Road Worli Mumbai -400018 (Maharashtra)",Mr. Nitul Shah,Director,"022-66541152
9833105668
",nitul.shah@creditcheckpartners.com,Consultancy Services ,,
349,SEPC/03/09/3635/2018-19,Institutional/Corporate Members ,Arya Voyagers Private Limited,312070101,"15B Chandermukhi Backbay Recl,Opp. Inox Theatre Nariman Point Mumbai-400021 (Maharashtra )",Maharashtra,31-03-2019,"15B Chandermukhi Backbay Recl,Opp. Inox Theatre Nariman Point Mumbai-400021 (Maharashtra )",Mr. Ravi Maniram Arya ,Director,"022-49229078
09769437571",ravi@arya.in,Maritime Transport Services  ,,
350,SEPC/02/03/3641/2018-19,Individual Ordinary Members  ,Ranbir Rishi Kapoor ,316924458,"Krishna Raj, 27 Pall Hill Bandra West Mumbai-400050 (Maharashtra)",Maharashtra,31-03-2019,"Krishna Raj, 27 Pall Hill Bandra West Mumbai-400050 (Maharashtra)",Mr. Ranbir Rishi Kapoor ,Proprietor ,9920060545,guravdk@gmail.com,Entertainment services including Audio-visual services,,
351,SEPC/02/04/3642/2018-19,Individual Ordinary Members  ,SJC Wire Products ,311033458,"630 Master Mind IV Royal Palms,Aarey Colony Goregaon East Mumbai -400065 (Maharashtra)
                                                 
",Maharashtra,31-03-2019,"630 Master Mind IV Royal Palms,Aarey Colony Goregaon East Mumbai -400065 (Maharashtra)
                                                 
",Mr. Hansmukhlal Bhanwarlal Jain ,Proprietor ,"022-28280034
09920838244","admin@sjcse.com
info@sjcse.com",Consultancy Services ,,
352,SEPC/03/09/3651/2018-19,Institutional/Corporate Members ,Paradip East Quay Coal Terminal Private Limited ,"AAICP5651K
      
","Jindal Mansion 5a,Dr. G Deshmukh Marg Mumbai-400026 (Maharashtra)",Maharashtra,31-03-2019,"Jindal Mansion 5a,Dr. G Deshmukh Marg Mumbai-400026 (Maharashtra)",Mr. Sudip Mishra ,Director,"022-42865055
09223236339",rohan.rao@jsw.in,Maritime Transport Services  ,,
353,SEPC/03/09/3653/2018-19,Institutional/Corporate Members ,KSS Shipping Services Private Limited ,AACCB5889M,"214, Great Eastern Galleria Sector -4 Nerul Navi Mumbai -400706 (Maharashtra)",Maharashtra,31-03-2019,"214, Great Eastern Galleria Sector -4 Nerul Navi Mumbai -400706 (Maharashtra)",Mr. Sandeep Bhargava ,Director,9167300370,sandeep@kss-shipping.com,Maritime Transport Services  ,,
354,SEPC/03/04/3658/2018-19,Institutional/Corporate Members ,Anglo-Eastern Maritime Services Private Limited ,AABCU5056E,"102 Mezzanine Floor Leela Business, Park Andheri Kurla Road Marol Andheri East Mumbai,maharashtra-400059",Maharashtra,31-03-2019,"102 Mezzanine Floor Leela Business, Park Andheri Kurla Road Marol Andheri East Mumbai,maharashtra-400059",Mr. Vinay Singh ,Director,"022-61124600
09619495132",vinay@angloeastern.com,Consultancy Services ,,
355,SEPC/03/04/3675/2018-19,Institutional/Corporate Members ,Western Union Services India Private Limited ,306032228,"Ground Floor Unit No. G-101, A. Wing Fortune 2000 Building BKC Bandra East Mumbai-400051 (Maharashtra )",Maharashtra,31-03-2019,"Ground Floor Unit No. G-101, A. Wing Fortune 2000 Building BKC Bandra East Mumbai-400051 (Maharashtra )",Mr. Mandar Thatte,Sr. Manager - Accounting & Finance,"022-66762912
'09819091701",mandar.thatte@westernunion.com,Consultancy Services ,,
356,SEPC/03/04/3681/2018-19,Institutional/Corporate Members ,Adity Designs Private Limited ,305057588,"Mumtaz Manzil 1st Floor 63/65, Wodehouse Road Colaba Mumbai-400005 (Maharashtra)",Maharashtra,31-03-2019,"Mumtaz Manzil 1st Floor 63/65, Wodehouse Road Colaba Mumbai-400005 (Maharashtra)",Mr. Sumangali Chandrakant Gada ,Director,"022-22188865
09820190750",sumangali@adity.net,Consultancy Services ,,
357,SEPC/03/04/3703/2018-19,Institutional/Corporate Members ,Xion Multiventures Private Limited ,316516023,"Unit no. 402, 4th Floor G-Wing Lotus Corporate Park Goregaon East  Mumbai Maharashtra -400063",Maharashtra,31-03-2019,"Unit no. 402, 4th Floor G-Wing Lotus Corporate Park Goregaon East  Mumbai Maharashtra -400063",Mr. Rajeev Ramavtar Agarwal ,Director,7208545999,ragarwal@arb-tg.com,Consultancy Services ,,
358,SEPC/03/03/3705/2018-19,Institutional/Corporate Members ,Hungama Digital Media Entertainment Private Limited,309068495,"SF-B-07, 2nd Floor Art Guild House Phoenix Market City LBS Marg Kurla W Mumbai -400070 (Maharashtra)",Maharashtra,31-03-2019,"SF-B-07, 2nd Floor Art Guild House Phoenix Market City LBS Marg Kurla W Mumbai -400070 (Maharashtra)",Mr. Neeraj Roy ,Director,"022-71653344
09930069724",sharath.shetty@hungama.com,"Entertainment services including audio-visula services; 
Advertising Services",,
359,SEPC/03/04/3710/2018-19,Institutional/Corporate Members ,Emerson Electric Company India Private Limited,395022193,"Delphi Bwing,604 6th Floor Hiranandani Business Park Powai Mumbai-400076 (Maharashtra)",Maharashtra,31-03-2019,"Delphi Bwing,604 6th Floor Hiranandani Business Park Powai Mumbai-400076 (Maharashtra)",Ms. Deepa Mahajan,"Deputy Manager, Finance","0724267506
09654113113",deepa.mahajan@emerson.com,Consultancy Services,,
360,SEPC/03/09/3711/2018-19,Institutional/Corporate Members ,One Ocean Network Express Line India Private Limited,AACCO5653N,3rd Floor A Wing Fulcrumhiranandani Business Park Sahar Road Andheri East Mumbai -400099 (Maharashtra),Maharashtra,31-03-2019,3rd Floor A Wing Fulcrumhiranandani Business Park Sahar Road Andheri East Mumbai -400099 (Maharashtra),Mr. Biswajit Chakraborty ,Director,"022-62153607
09821329523",biswajit.chakraborty@oneline.com,Maritime Transport Services ,,
361,SEPC/02/03/3712/2018-19,Individual Ordinary Members  ,Blue Lion Entertainment Co. ,315067101,"A-704, Remibizcourt Off Veera Desai Road Andheri-West Mumbai -400053 (Maharashtra )",Maharashtra,31-03-2019,"A-704, Remibizcourt Off Veera Desai Road Andheri-West Mumbai -400053 (Maharashtra )",Mr. Hirachand Dand,Proprietor,"022-66957138
07738508150",madhuentertainment@gmail.com,Entertainment services including Audio-visual services,,
362,SEPC/03/07/3716/2018-19,Institutional/Corporate Members ,TMF Services India Private Limited ,307092496,"1302, 13th Floor India Bulls Finance Centre SB Marg Elphinstone Road Dad Mumbai -400013 (Maharashtra)",Maharashtra,31-03-2019,"1302, 13th Floor India Bulls Finance Centre SB Marg Elphinstone Road Dad Mumbai -400013 (Maharashtra)",Mr. Jatin Yashwantlal Mehta,Director,"022-49217314
09820459084",jatin.mehta@tmf-group.com,"Accounting/Auditing and Book Keeping Services;
Consultancy Services",,
363,SEPC/03/10/3719/2018-19,Institutional/Corporate Members ,Spenta Multimedia Private Limited,315900407,"Wadia Building Flat No. 2, Babulnath Road 
Mumbai -400007 (Maharashtra)
",Maharashtra,31-03-2019,"Wadia Building Flat No. 2, Babulnath Road 
Mumbai -400007 (Maharashtra)
",Mr. Maneck Eruch Davar ,Director,"022-24811010
09821022501",ho@spentamultimedia.com,Advertising Services;  Printing & Publishing Services,,
364,SEPC/03/07/3728/2018-19,Institutional/Corporate Members ,Vodafone India Services Private Limited,302043756,"1201 , 12th Floor  Tower 1, India bulls Finance Centre  S. B Road Mumbai-400013 (Maharashtra)",Maharashtra,31-03-2019,"1201 , 12th Floor  Tower 1, India bulls Finance Centre  S. B Road Mumbai-400013 (Maharashtra)",Mr. Amit Gupta,Authorised Signatory,"022-41274000
08411885478",amit.ahuja2@vodafone.com,Accounting/Auditing and book keeping services; Consultancy Services,,
365,SEPC/03/04/3730/2018-19,Institutional/Corporate Members ,Iksula Services Private Limited,309083184,B-702 mangalya building off. Marol Maroshi Road Andheri-East Mumbai-400059 (Maharashtra),Maharashtra,31-03-2019,B-702 mangalya building off. Marol Maroshi Road Andheri-East Mumbai-400059 (Maharashtra),Mr. Samarjeet Singh,Director,"022-66330100
09868020005",samar@iksula.com,Consultancy Services  ,,
366,SEPC/03/04/3781/2018-19,Institutional/Corporate Members ,Devashish Polymers Private Limited ,397092831,"C/O. E.V.E.Fabrics Pvt. ltd., NTC House N. M. MARG, Ballard Estate Mumbai -400038 (Maharashtra)",Maharashtra,31-03-2019,"C/O. E.V.E.Fabrics Pvt. ltd., NTC House N. M. MARG, Ballard Estate Mumbai -400038 (Maharashtra)",Mr. Nikhil Mody,Director,"022-22613440
09967045342",finance@devashishpolymers.com,Consultancy Services;  Marketing Research and Public Opinion Polling Services/Management Services; Legal Services,,
367,SEPC/03/04/3784/2018-19,Institutional/Corporate Members ,Kellogg India Private Limited,393032043,"Plot L2 & L3, Taloja MIDC Mumbai Maharashtra -410208",Maharashtra,31-03-2019,"Plot L2 & L3, Taloja MIDC Mumbai Maharashtra -410208",Mr. Dinesh Charak,Director - Legal,9845081914,dinesh.charak@kellogg.com,Consultancy Services; Marketing Research and Public Opinion Polling Services/Management Services; Legal Services; Other Services ,,
368,SEPC/03/12/3901/2018-19,Institutional/Corporate Members ,Sony Dadc Manufacturing India Private Limited ,396044751,"C-106, TTC Industrial Area MIDC Pawane Navi Mumbai Navi Mumbai Maharashtra-400705",Maharashtra,31-03-2019,"C-106, TTC Industrial Area MIDC Pawane Navi Mumbai Navi Mumbai Maharashtra-400705",Mr. Milin V. Sulakhi,Dy. Director General,"71116200
09820811762",milin.sulakhi@sonydadc.com,Printing & Publishing Services,,
369,SEPC/03/05/3910/2018-19,Institutional/Corporate Members ,Patel Microdata Private Limited,388080817,6 Elphiston Building 10 Vir Nariman Road Fort  Mumbai Maharashtra -400023,Maharashtra,31-03-2019,6 Elphiston Building 10 Vir Nariman Road Fort  Mumbai Maharashtra -400023,Mr. Cyrus Shavak Patel,Director,"022-23865610
09821029787",cyrus@csppatel.com,Architectural Services and related services; Consultancy Services,,
370,SEPC/03/04/3914/2018-19,Institutional/Corporate Members ,Decimal Point Analytics Private Limited,306007282,"5-A, B Wing Tradestar Building J. B. Nagar Andheri Kurla Road Andheri East Mumbai -400059 (Maharashtra)",Maharashtra,31-03-2019,"5-A, B Wing Tradestar Building J. B. Nagar Andheri Kurla Road Andheri East Mumbai -400059 (Maharashtra)",Mr. Paresh Sharma,Executive Director,"022-30015200
09930197466",accounts@decimalpointanalytics.com,Consultancy Services ,,
371,SEPC/03/01/835/2009-10,Institutional/Corporate Members ,HCG Medi-Surge Hospitals Private Limited ,801009251,"Medisurge Hospitals, 1 Maharashtra Society, Mithakali Cross Roads, Ahemdabad - 380006",Maharashtra,31-03-2019,"Medisurge Hospitals, 1 Maharashtra Society, Mithakali Cross Roads, Ahemdabad - 380006",Dr. Bharat S Gadhavi                                        ,Regional Director,"079-40010101, 09825065555
",bharat.gadhavi@hcghospitals.in; himadri.mehta@hcghospitals.in,"Healthcare services including services by nurses, physiotherapist and paramedical personnel",,
372,SEPC/03/02/1890/2013-14,Institutional/Corporate Members ,Datta Meghe Institute of Medical Sciences,302009299,"SDMP Campus, Atrey Layout, Nagpur – 440022, Maharashtra ",Maharashtra,31-03-2019,"SDMP Campus, Atrey Layout, Nagpur – 440022, Maharashtra ",Mr. Sagar Meghe                                      ,Treasurer,"0712-2229977
2229988
9373104040","ryashroy@dmims.org
info@dmims.org; ",Educational Services ,,
373,SEPC/03/09/2882/2016-17,Institutional/Corporate Members ,Hamburg Sud India Private Limited,310041031,"Forbes Building  4th Floor, Charanjit Rai Marg, Fort Maharashtra-400001.",Maharashtra,31-03-2019,"Forbes Building  4th Floor, Charanjit Rai Marg, Fort Maharashtra-400001.",Mr. Ashokanand John,Dirctor,"09167733051
022-61245600",ashok.john@hamburgsud.com,Maritime Transport Services ,,
374,SEPC/03/04/2721/2016-17,Institutional/Corporate Members ,Varroc Engineering Pvt. Ltd. ,390019402,"L-4, MIDC Area Waluj, Aurangabad - 431136, Maharashtra ",Maharashtra,31-03-2019,"L-4, MIDC Area Waluj, Aurangabad - 431136, Maharashtra ",Mr. Santosh Sharma,General Manager,"0240-6653700
9673001310",sharma.santosh@varrocgroup.com,"Consultancy Services
Accounting/Auditing and Book Keeping Services
Marketing Research and Public Opinion Polling Services/Management Services
Legal Services ",,
375,SEPC/03/04/2722/2016-17,Institutional/Corporate Members ,Varroc Polymers Pvt. Ltd.,395044308,"Plot No. L-4, MIDC Area, Waluj, Aurangabad, Maharashtra - 431136",Maharashtra,31-03-2019,"Plot No. L-4, MIDC Area, Waluj, Aurangabad, Maharashtra - 431136",Mr. Santosh Sharma,General Manager,"0240-6653700
9673001310",sharma.santosh@varrocgroup.com,"Consultancy Services
Accounting/Auditing and Book Keeping Services
Marketing Research and Public Opinion Polling Services/Management Services
Legal Services ",,
376,SEPC/03/04/2892/2016-17,Institutional/Corporate Members ,General Atlantic Private Ltd.,305047353,"Level 19, Birla Aurora, Dr. Annie Besant Road, Wroli, Maharashtra - 400030",Maharashtra,31-03-2019,"Level 19, Birla Aurora, Dr. Annie Besant Road, Wroli, Maharashtra - 400030",Mr. Amit Soni,Director,"022-66561400, 66561418
9867622196",asoni@generalatlantic.com,Consultancy Services,,
377,SEPC/02/13/2674/2016-17,Individual Ordinary Members  ,ARA Law,316900389,"Unit No. 1001, C, The Capital Bwing C-70, Bandra Kurla Complex, 10th Floor, Bandra East Maharashtra - 400051",Maharashtra,31-03-2019,"Unit No. 1001, C, The Capital Bwing C-70, Bandra Kurla Complex, 10th Floor, Bandra East Maharashtra - 400051",Mr. Rajesh Nanjundian Begur,Managing Partner,"022-66199800
9820096287",rajesh@aralaw.com,Legal Services,,
378,SEPC/03/04/2219/2014-15,Institutional/Corporate Members ,Ingenero Technologies (India) Pvt. Ltd.,302002499,"Unit No. 2, 8th Floor, A -Wing, I Think Techno Cmapus, Pokhran Road, No. 2, Thane-West, Thane - 400607, Maharashtra",Maharashtra,31-03-2019,"Unit No. 2, 8th Floor, A -Wing, I Think Techno Cmapus, Pokhran Road, No. 2, Thane-West, Thane - 400607, Maharashtra","Mr. Kishor Patil
",Director,"022-61764650/52
9820008356
9820222315
(Mr. Pratap Nair - 9820222315)","kpatil@ingenero.com
pnair@ingenero.com",Consultancy Serivces,,
379,SEPC/03/07/3052/2017-18,Institutional/Corporate Members ,Anderson Business Solutions Private Limited ,312028946,"3rd Floor, MBC Park Building D, G Hodbunder Road Kasarvadavali Thane West, Maharashtra - 400615",Maharashtra,31-03-2019,"3rd Floor, MBC Park Building D, G Hodbunder Road Kasarvadavali Thane West, Maharashtra - 400615",Mr. Sandeep Modi,Managing Director,"022-67362100
67362121
7666436428",sandeepm@andersongroup.com,Accounting/Auditing and Book Keeping Services,,
380,SEPC/02/04/3426/2017-18,Individual Ordinary Members  ,Bathiya & AssociateS LLP ,316514764,"910, Hubtown Solaris, N. S. Phadke Road Andheri East-400069 (Maharashtra)",Maharashtra,31-03-2019,"910, Hubtown Solaris, N. S. Phadke Road Andheri East-400069 (Maharashtra)",Mr. Shailesh Haridas Bhathiya,Partner,"022-61338000
09821012643",shailesh.bathiya@bathiya.com,Consultancy Services,,
381,SEPC/02/13/3325/2017-18,Individual Ordinary Members  ,Bathiya Legal,316514527,"909, Hubtown Solaris N. S. Phadke Marg Andheri East -400069 (Maharashtra)",Maharashtra,31-03-2019,"909, Hubtown Solaris N. S. Phadke Marg Andheri East -400069 (Maharashtra)",Mr. Pankaj Haridas Bathiya,Partner,"022-61338052
09833939291",pankaj.bathiya@bathiyalegal.com,Legal Services ,,
382,SEPC/03/07/3056/2017-18,Institutional/Corporate Members ,Mindware Outsourcing Private Limited,307000087,"Atlanta Arcade, 2nd Floor, Church Road, Opp. Hotel, Leela Marol Andheri East Maharashtra - 400059",Maharashtra,31-03-2019,"Atlanta Arcade, 2nd Floor, Church Road, Opp. Hotel, Leela Marol Andheri East Maharashtra - 400059",Mr. Himesh Desai,Director,"022-66942701
9819012773",accounts@knitextextiles.com,Accounting/Auditing and Book Keeping Services,,
383,SEPC/03/09/3255/2017-18,Institutional/Corporate Members ,Modern Cargo Services Private Limited,AAACM7088B,"Plot No. 14, 3rd Floor, Samhitaware Housing Complex, Andheri East - 400072, Maharashtra",Maharashtra,31-03-2019,"Plot No. 14, 3rd Floor, Samhitaware Housing Complex, Andheri East - 400072, Maharashtra",Mr. Firdos Fali Fanibanda,Managing Director,"022-67111000
9820083434",firdos@moderncargo.com,Maritime Transport Services ,,
384,SEPC/02/04/3193/2017-18,Individual Ordinary Members  ,Protium Pharma India LLP ,313036195,"B-206, Classique Centre 26, Mahal Ind. Estate Off Mahakali Caves Rd Andheri East, Maharashtra-400093",Maharashtra,31-03-2019,"B-206, Classique Centre 26, Mahal Ind. Estate Off Mahakali Caves Rd Andheri East, Maharashtra-400093",Mr. Aditya Rajendra Kankan ,Designated Partner,"022-40056380
09920844436",aditya@protiumpharma.com,Consultancy Services ,,
385,SEPC/03/04/2955/2017-18,Institutional/Corporate Members ,Worley Parsons India Private Limited ,315901004,"5th Floor B Wing I Think Techno,Campus Off Pokhran Rd No 2 Thane West Maharashtra -400607",Maharashtra,31-03-2019,"5th Floor B Wing I Think Techno,Campus Off Pokhran Rd No 2 Thane West Maharashtra -400607",Mr. Naresh Kumar P. Bilala,Director,"022-67818000
09987275581",naresh.kumar@worleyparsons.com,Consultancy Services ,,
386,`SEPC/03/04/3145/2017-18,Institutional/Corporate Members ,Colvill Research Private Limited,307099253,101/102 1st Floor A Wing Supreme Business Park Behind Lake Castle?Powai Maharashtra?-400076,Maharashtra,31-03-2019,,PREM SRAMPICAL APRAIN,Director,,rakesh.p@colvillbanks.com,Consultancy Services,,
387,SEPC/03/09/3514/2018-19,Institutional/Corporate Members ,Sai Maritime And Management Private Limited,304054453,"1112.A, Embassy Centre Nariman Point Maharashtra  -400021",Maharashtra,31-03-2019,"1112.A, Embassy Centre Nariman Point Maharashtra  -400021",Mr. Khalid S.Vohara,Director,"022-66513600
09820020377",khalid@saiship.com,Maritime Transport Services  ,,
388,SEPC/03/04/3555/2018-19,Institutional/Corporate Members ,Osborn Lippert (India) Private Limited ,392036673,"E-65/66,  M. I. D. C. Area Waluj Aurangabad Maharashtra-431136",Maharashtra,31-03-2019,"E-65/66,  M. I. D. C. Area Waluj Aurangabad Maharashtra-431136",Mr. Shirish Shrikant Tambe ,Director,"02402556538
09372007217",stambe@osborn-lippert.co.in,Consultancy Services ,,
389,SEPC/02/07/3616/2018-19,Individual Ordinary Members  ,Sureshkumar Haribhai Patel ,ACLPP0596R,Ravrai Umaji Colony Station Road Bansilal  Nagar  Aurangabad -431005 (Maharashtra),Maharashtra,31-03-2019,Ravrai Umaji Colony Station Road Bansilal  Nagar  Aurangabad -431005 (Maharashtra),Mr. Sureshkumar Haribhai Patel ,Proprietor,"0840-8966600
08408966600",suresh.ppp@gmail.com,Accounting/Auditing and Book Keeping Services,,
390,SEPC/03/01/3617/2018-19,Institutional/Corporate Members ,Sindhudurg Shikshan Prasarak Mandal Kankavli ,3116921989,SSPM Medical College Lifetime Hospital Padve Kudal -416534 (Maharashtra),Maharashtra,31-03-2019,SSPM Medical College Lifetime Hospital Padve Kudal -416534 (Maharashtra),Mr. Nilesh Narayan Rane,Vise President,"2367-230214
09821017000",reachnileshrane@gmail.com,"Healthcare services including services by nurses, physiotherapist and paramedical personnel;  Educational Services",,
391,SEPC/03/01/3621/2018-19,Institutional/Corporate Members ,Diagnosearch Life Sciences Private Limited ,395049393,702 Dosti Pinnacle Plot No. E-7 Road No. 22 Wagle Indl. Estate Thane Maharashtra -400604,Maharashtra,31-03-2019,702 Dosti Pinnacle Plot No. E-7 Road No. 22 Wagle Indl. Estate Thane Maharashtra -400604,Mr. Gajendra Sharma,Controller - Finance & Accounts,"022-67776300
09820918613",gajendra.sharma@diagnosearch.com,"Healthcare services including services by nurses, physiotherapist and paramedical personnel  ",,
392,SEPC/03/04/3662/2018-19,Institutional/Corporate Members ,Diligent Tech India Private Limited ,316915700,"F-303, Jairaj Nagar Manav Mandir Complex, Vasai Road Thane Maharashtra -401202",Maharashtra,31-03-2019,"F-303, Jairaj Nagar Manav Mandir Complex, Vasai Road Thane Maharashtra -401202",Mr. Farhan Mubashir,Director,"0124-4058041
09899284414",farhan.mubashir@diligentconsulting.co.in,Consultancy Services ,,
393,SEPC/03/09/3729/2018-19,Institutional/Corporate Members ,Sai Shipping Company Private Limited ,397008538,1109 Embassy Centre Nariman Point Maharashtra -400021,Maharashtra,31-03-2019,1109 Embassy Centre Nariman Point Maharashtra -400021,Mr. Khaild S Vohra,Director,"022-66513600
09820020377",khalid@saiship.com,Maritime Trransport Services ,,
394,SEPC/03/04/3747/2018-19,Institutional/Corporate Members ,ADA Annex Advisory Services Private Limited,317507061,10th Floor Aston Building Sundervan Complex Road Sundervan Complex Shastri Nagar Andheri West -400053 (Maharashtra),Maharashtra,31-03-2019,10th Floor Aston Building Sundervan Complex Road Sundervan Complex Shastri Nagar Andheri West -400053 (Maharashtra),Mr. Gautam Sachdev,Dircetor,"022-62640884
09035500901",kudeshi@55ip.com,Consultancy Services  ,,
395,SEPC/03/11/3900/2018-19,Institutional/Corporate Members ,KKR India Advisors Private Limited ,309021863,"2nd Floor, Piramal Towers Peninsula Corporate Park G. K. Marg Lower Parel -400013 (Maharashtra)",Maharashtra,31-03-2019,"2nd Floor, Piramal Towers Peninsula Corporate Park G. K. Marg Lower Parel -400013 (Maharashtra)",Mr. Ankit Agarwal,Vise President,"022-43551398
08879490442",ankit.agarwal@kkr.com,Marketing Research and Public Opinion Polling Services/Management Services,,
396,SEPC/03/14/3925/2018-19,Institutional/Corporate Members ,Chinagate Restaurants Private Limited,305023705,"155, Tamang Niwas Waterfield Road Bandra WEST -400050 (Maharashtra)",Maharashtra,31-03-2019,"155, Tamang Niwas Waterfield Road Bandra WEST -400050 (Maharashtra)",Mr. Mahesha Giriyappa,Chief Financial Officer,"022-42631000
09820272360",mgsalian@yahoo.com,Hotel and Tourism related services ,,
397,SEPC/03/14/392/2008,Institutional/Corporate Members ,Walled City Hotels Pvt. Ltd. ,1308010320,"Narpat Niwas, Old Pali Road, Jodhpur – 342005, Rajasthan ",Rajasthan,31-03-2019,"Tunwarji Ka Jhalara, Makrana Mohalla, Jodhpur - 342001, Rajasthan",Mr. Nikhilendra Singh                                        ,Managing Director ,"0291-2632207, 2636455, 09829024124",nikhilendra@raasjodhpur.com,Hotel and Tourism related services ,,
398,SEPC/03/14/962/2010-11,Institutional/Corporate Members ,Historic Resort Hotels Private Limited,1397001313,"City Palace, Udaipur – 313001, Rajasthan",Rajasthan,31-03-2019,"City Palace, Udaipur – 313001, Rajasthan",Mr. Arvind Singhji Mewar                        ,Chairman,"0294-2528016-19
 09829051000",mewar@eternalmewar.in,Hotel and Tourism Related Services ,,
399,SEPC/03/14/953/2010-11,Institutional/Corporate Members ,Rajput Hotel & Resorts Private Limited,1305004311,"City Phase, Udaipur – 313001, Rajasthan",Rajasthan,31-03-2019,"City Phase, Udaipur – 313001, Rajasthan",Mr. Lakshyaraj Singh Mewar                  ,Director,"0294-2419021-29, 09829044230",lakshyarajsingh.mewar@eternalmewar.in,Hotel and Tourism Related Services ,,
400,SEPC/03/14/952/2010-11,Institutional/Corporate Members ,Shikarbadi Hotel Private Limited,1388014505,"Goverdhan Vilas Udaipur – 313002, Rajasthan",Rajasthan,31-03-2019,"Goverdhan Vilas Udaipur – 313002, Rajasthan",Mr. Arvind Singhji Mewar                        ,Chairman,"0294-2528016-19, 09829051000",mewar@eternalmewar.in,Hotel and Tourism Related Services ,,
401,SEPC/03/14/970/2010-11,Institutional/Corporate Members ,Shiv Niwas Palace (A Unit of The Lake Shore Palace Hotel Private Limited) (formerly - M/s. The Lake Shore Palace Hotel Private Limited),1388011549,"City Palace, Udaipur – 313001, Rajasthan",Rajasthan,31-03-2019,"City Palace, Udaipur – 313001, Rajasthan",Mr. Arvind Singhji Mewar                        ,Managing Director                                                             ,0294-2528016-19/ 09829051000,mewar@eternalmewar.in,Hotel and Tourism Related Services ,,
402,SEPC/03/14/961/2010-11,Institutional/Corporate Members ,The Lake Palace Hotels & Motels Private Limited,1388003465,"City Palace, Udaipur – 313001, Rajasthan",Rajasthan,31-03-2019,"City Palace, Udaipur – 313001, Rajasthan",Mr. Arvind Singhji Mewar                        ,Managing Director                                                             ,"0294-2528016-19, 09829051000",mewar@eternalmewar.in,Hotel and Tourism Related Services ,,
