926,SEPC/03/14/2812(A)/2016-17,Institutional/Corporate Members ,Active India Holidays Private Limited,516944908,"803-804, Kriti Shikhar Building, District Centre Jankpuri, New Delhi-110058",Delhi,31-03-2019,"803-804, Kriti Shikhar Building, District Centre Jankpuri, New Delhi-110058",Mr. Ravinder Kumar Tickoo,Director,"09818379790
011-25613968; 25545339",ravi@activeindiaholidays.com,Hotel and Tourism related services,,
927,SEPC/03/04/2505/2016-17,Institutional/Corporate Members ,Agile Consulting Private Limited,506056660,"F-87-1st Floor, Green Park Main, New Delhi - 110016",Delhi,31-03-2019,"F-87-1st Floor, Green Park Main, New Delhi - 110016",Mr. Punit Jindal,Director,"0124-4044402
9810288955",pjindal@agilecon.in,Consultancy Services,,
928,SEPC/03/14/2758/2016-17,Institutional/Corporate Members ,Air Travel Bureau Ltd.,594044979,"M-95, Connaught Circus, New Delhi - 110001",Delhi,31-03-2019,"M-95, Connaught Circus, New Delhi - 110001",Mr. Ashish Kumar Bansal,General Manager,"011-45357700
9810430899",ashish@uniglobeatb.com,Hotel and Tourism related services ,,
929,SEPC/02/14/2575/2016-17,Individual Ordinary Members  ,Ajanta Travel Services,516906364,"WZ 491 MS Block Hari Nagar, New Delhi - 110064",Delhi,31-03-2019,"WZ 491 MS Block Hari Nagar, New Delhi - 110064",Mr. Manoj Dewan,Proprietor ,"011-25128937
9810546004",ajantatravelservices@gmail.com,Hotel and Tourism related Services,,
930,SEPC/02/14/2816/2016-17,Individual Ordinary Members  ,Alpcord Network Travel and Conferences Management Co. ,516935186,"614, 6th Floor, New Delhi House, 27, Barakhamba Road, New Delhi - 110001",Delhi,31-03-2019,"614, 6th Floor, New Delhi House, 27, Barakhamba Road, New Delhi - 110001",Mr. Chander Manshramani ,Proprietor ,"011-49104011
9811059036
","mchander@alpcord.net
chetan.m@alpcord.com",Hotel and Tourism related services ,,
931,SEPC/03/14/2636/2016-17,Institutional/Corporate Members ,Amber Tours Private Limited,594044251,"707, Akash Deep Building, Barakhamba Road, New Delhi - 110001",Delhi,31-03-2019,"707, Akash Deep Building, Barakhamba Road, New Delhi - 110001",Mr. Kewal Krishan Sabharwal,Director,"011-23737581,
23736523
9810104170","kewal.sabharwal@ambertours.in
",Hotel and Tourism related Services,,
932,SEPC/03/14/2554/2016-17,Institutional/Corporate Members ,Ancient India Travels Pvt. Ltd.,515036421,"EA-150/2, Tagore Garden, New Delhi - 110027",Delhi,31-03-2019,"EA-150/1, Tagore Garden, New Delhi - 110027",Mr. Pradeep Singh Thakur,Director ,"011-25112411
9810262022","ancient@airtelmail.in
va_arora@yahoo.co.in",Hotel and Tourism related Services,,
933,SEPC/03/14/2631/2016-17,Institutional/Corporate Members ,"Apollo Voyages Private Limited
",594037590,"40, Yashwant Place Chanakyapuri, New Delhi - 110021",Delhi,31-03-2019,"36, Yashwant Place Chanakyapuri, New Delhi - 110021",Mr. Dilbar Singh Rawat,Director,"011-24677515; 24107979
9811505097","apollovoyages@usa.net; rawat.apollovoyages@gmail.com
info@apollovoyages.com",Hotel and Tourism related Services,,
934,SEPC/03/07/2534/2016-17,Institutional/Corporate Members ,Avery Dennison India Pvt. Ltd. ,596017871,"B-92, 9th Floor, Himalaya House, 23 KG Marg, New Delhi - 110001",Delhi,31-03-2019,"11th Floor, spaze Platinum Tower, Sector-47, Sohna Road, Gurugram - 120018",Mr. Saurabh Agarwal,Director,"0124-4823848
9818224830","saurabh.agarwal@ap.averydennison.com
muralie.ks@ap.averydennison.com",Accounting/Auditing and Book Keeping services,,
935,SEPC/03/07/2698/2016-17,Institutional/Corporate Members ,BBW Business Services Pvt. Ltd. ,516906291,"69A, 3rd Floor, Vijaya Block, Laxmi Nagar, Delhi - 110092",Delhi,31-03-2019,"69A, 3rd Floor, Vijaya Block, Laxmi Nagar, Delhi - 110092",Mr. Umesh Kumar Agrawal,Director,"011-22437473
9811382850",umesha@bbw-services.com,Accounting/Auditing and book keeping services; ,,
936,SEPC/03/07/2851/2016-17,Institutional/Corporate Members ,Bechtel India Private Limited,594045738,"418, Naurang House 21 K. G. Marg New Delhi-110001",Delhi,31-03-2019,"244-245, Knowledge Park, Ph-IV, Udyog Vihar, Gurgaon- 122015, Haryana",Mr. Narayan Ayalur Subramanian,Director,"09810071583;
0124-4098000",asnaraya@bechtel.com,Accounting/Auditing and Book Keeping Services,,
937,SEPC/03/04/2904/2016-17,Institutional/Corporate Members ,Clearpath Technology Pvt. Ltd. ,513076760,"II & III Floor, Plot No. 8, Anshul Plaza, Sector-10, Dwarka, New Delhi - 110075",Delhi,31-03-2019,"II & III Floor, Plot No. 8, Anshul Plaza, Sector-10, Dwarka, New Delhi - 110075",Mr. Deepak Bansal,Director,"011-28080250
9871084488",deepak@clearpathtechnology.com,Consultancy Services,,
938,SEPC/03/14/2640/2016-17,Institutional/Corporate Members ,Compass India Holidays Private Limited,515910716,"35, Link Road, Lajpat Nagar, Part-III, New Delhi - 110024",Delhi,31-03-2019,"35, Link Road, Lajpat Nagar, Part-III, New Delhi - 110024",Mr. Durjay Sengupta,Director,"011-40728215
9810291296","kavita@compassindiainc.com
durjaysengupta@gmail.com",Hotel and Tourism related Services,,
939,SEPC/03/14/2870/2016-17,Institutional/Corporate Members ,Connexons Travel (India) Pvt. Ltd. ,501042041,"119, Sishan House, Second Floor, Shahpur Jat New Delhi - 110049",Delhi,31-03-2019,"261, First Floor, Lane No.5, Westend Marg Sidulajab, New Delhi - 110030",Mr. Sunil Puri,Director,"72900507766
9811153318",puri@mileage.in ,Hotel and Tourism related services ,,
940,SEPC/03/07/2656/2016-17,Institutional/Corporate Members ,Delonex Energy India Private Limited,514026359,"Unit No. 216, 2nd Floor, Square one, C-2, District Centre, Saket, New Delhi - 110017",Delhi,31-03-2019,"Suite 376, Leela Kempinski, Ambience Island, DLF Phase-III, Gurgaon - 122002, Haryana",Mr. Ramesh Maruthai,Director,"0124-4665445
9971494053",ramesh.maruthai@delonexenergy.com,Accounting/Auditing and Book Keeping Services,,
941,SEPC/03/14/2560/2016-17,Institutional/Corporate Members ,Desert Friendly Camps Private Limited,509090508,"1, Sri Aurobindo Marg, Hauz Kahs, New Delhi - 110016",Delhi,31-03-2019,"1, Sri Aurobindo Marg, Hauz Kahs, New Delhi - 110016",Mr. Jagdeep singh oberoi,Director,"011-49171700
08800176368",accounts1@sujanluxury.com,Hotel and Tourism related Services,,
942,SEPC/02/13/2815/2016-17,Individual Ordinary Members  ,DGS Associates,516911155,"55 Community Centre, 2nd Floor, East of Kailash, New Delhi - 110065",Delhi,31-03-2019,"55 Community Centre, 2nd Floor, East of Kailash, New Delhi - 110065",Ms. Ameeta Verma Duggal,Partner,"011-41749277
9811298043",ameeta@dgsassociates.in,Legal Services,,
943,SEPC/03/11/2553/2016-17,Institutional/Corporate Members ,Eastman Auto & Power Ltd. ,506057381," Flat no.101 First Floor, 1 Community Centre, Naraina Industrial Area, Phase-1, New Delhi -110028",Delhi,31-03-2019,"Plot no 547, Udhyog vihar phase-V, Gurgaon haryana-122001",Mr. Shekhar Singhal,Managing Director,"9818800444
01242877100",shekhar@eastmanglobal.com,Marketing Research and Public Opinion Polling Services Management Services,,
944,SEPC/02/14/2548/2016-17,Individual Ordinary Members  ,Eastwind Holidays India ,504081853,"C-222, Sarovdaya Enclave, New Delhi - 110016",Delhi,31-03-2019,"C-222, Sarovdaya Enclave, New Delhi - 110016",Mr. Rajesh Gupta ,Partner ,"26856656
9811032348",info@eastwindholidaysindia.com,Hotel and Tourism related Services,,
945,SEPC/03/14/2509/2016-17,Institutional/Corporate Members ,Enriching Journeys Private Limited,516904906,"323, Third Floor, Vardhman Crown Plaza, Plot No. 2, Sector -19, Dwarka, New Delhi - 110075",Delhi,31-03-2019,"323, Third Floor, Vardhman Crown Plaza, Plot No. 2, Sector -19, Dwarka, New Delhi - 110075",Mr. Alok Singh ,Director,"011-28043153
09810627774",alok@enrichingjourneys.com,Hotel and Tourism related Services,,
946,SEPC/03/14/2833/2016-17,Institutional/Corporate Members ,Eprime Travels.Com Private Limited,515063797,"L-8, Green Park Extn., New Delhi-110016",Delhi,31-03-2019,"L-8, Green Park Extn., New Delhi-110016",Mr. Arun Verma,Managing Director,"09810277463
011-46700000",arun@primetravels.com,"Hotel and Tourism related services; 
Consultancy Serviecs",,
947,SEPC/02/14/2524/2016-17,Individual Ordinary Members  ,Equinox ,599000708,"Hotel Flora, 1st Floor, 4933-4936, Dayanand Marg, Daryaganj, New Delhi - 110002",Delhi,31-03-2019,"Hotel Flora, 1st Floor, 4933-4936, Dayanand Marg, Daryaganj, New Delhi - 110002",Ms. Gita Bhalla,Proprietor ,"011-23288135
9811039068",accounts@equinoxtravelindia.com,Hotel and Tourism related Services,,
948,SEPC/03/14/2654/2016-17,Institutional/Corporate Members ,"Erco Travels Pvt. Ltd. 
",501065903,"F-204-206, Ashish Complex, LSC Mayur Vihar, Phase-1, Delhi - 110091",Delhi,31-03-2019,"F-204-206, Ashish Complex, LSC Mayur Vihar, Phase-1, Delhi - 110091",Mr. Ravi Raman Singh Gosain,Director ,"011-45319911
9810005635",ravi@ercotravels.com ,Hotel and Tourism related Services,,
949,SEPC/03/14/2646/2016-17,Institutional/Corporate Members ,Greaves Travel India Private Limited ,508057931,"4-B, Jangpura-B, Mathura Road, New Delhi - 110014",Delhi,31-03-2019,"4-B, Jangpura-B, Mathura Road, New Delhi - 110014",Ms. Mala Tandan,Director,"43237000, 9811041903",mata.tandan@greaves-travel.co.in ,Hotel and Tourism related Services,,
950,SEPC/03/04/2754/2016-17,Institutional/Corporate Members ,Green Power International Pvt. Ltd. ,503005134,"A-701, Hindon Appartment 25, Vasundhara Enclave, Delhi - 110096",Delhi,31-03-2019,"E-12A, Sector-63, Noida - 201301 (U.P.)",Mr. Sanjeev Puri,Managing Director,"0120-4655485
9717099416",taxation@greenpowerintl.com,Consultancy Services,,
951,SEPC/02/04/2529/2016-17,Individual Ordinary Members  ,India International Technical Recruiters,516916858,"4868/24, Ansari Road, Darya Ganj, New Delhi - 110002",Delhi,31-03-2019,"4868/24, Ansari Road, Darya Ganj, New Delhi - 110002",Col. Gurinder Singh,Managing Partner,"011-41563463
9818696717",iitr@hireindians.com,Consultancy Services,,
952,SEPC/03/14/2573/2016-17,Institutional/Corporate Members ,"Indian Legends Holidays Private Limited 
",515030317,"Plot No. 2 LSC Oberoi House, Milan, Cinema Complex, Karampura, Motinagar, New Delhi - 110015",Delhi,31-03-2019,"Plot No. 2 LSC Oberoi House, Milan, Cinema Complex, Karampura, Motinagar, New Delhi - 110015",Mr. Ravinder Kumar,Director,"011-40783300
9871901113
","rkumar@indianlegends.co.in, ",Hotel and Tourism related Services,,
953,SEPC/03/14/2680/2016-17,Institutional/Corporate Members ,IREO Hospitality Company Private Limited,'0510030181,"A-11, 1ST Floor Neeti Bagh New Delhi-110049",Delhi,31-03-2019,"IREO Cmpus, Sector-59, Gurgaon - 122101 (Haryana)",Mr. Anupam Nagalia,Director,"09818501110;
0124-479500",anupam.nagalia@ireo.in ,Hotel and Tourism related services ,,
954,SEPC/03/04/2649/2016-17,Institutional/Corporate Members ,Jindal Poly Films Limited ,588065781,"Plot No.12, Local Shopping Complex, Sector-B-1, Vasant Kunj New Delhi -110070",Delhi,31-03-2019,"Plot No.12, Local Shopping Complex, Sector-B-1, Vasant Kunj New Delhi -110070",Mr. Sanjay Kapote,Director,"9717253232
011-26139256
09650152324",exportlogestic@jindalgroup.com,Consultancy Services ,,
955,SEPC/03/14/2547/2016-17,Institutional/Corporate Members ,KAJ Infrastructure Pvt. Ltd.,514074604,"151, Savita Vihar, New Delhi - 110092",Delhi,31-03-2019,"Unit No.601-604, 7th Floor, KM Trade Tower, Sec.-14, Kaushambi Gaziabad - 201010.",Mr. Karan Jain,Director ,"0120-4614800, 19
09971999955",karan.jain@kmgroupindia.com,Hotel and Tourism related Services,,
956,SEPC/03/14/2849/2016-17,Institutional/Corporate Members ,Kash Venture Travels Private Limited,516000603,805-806 Kirti Shikhar District Centre Janakpuri Delhi -110058,Delhi,31-03-2019,805-806 Kirti Shikhar District Centre Janakpuri Delhi -110058,Mr. Mohan Lal Tickoo,Managing Director,"9811040818
011-25593279",info@kvtholidays.com; mohan@kvtindia.com,Hotel and Tourism related services ,,
957,SEPC/03/14/2736/2016-17,Institutional/Corporate Members ,Ker India Tours Private Limited,515077721,103/9 Allies bhavan L.S.C. madangir New delhi-110062,Delhi,31-03-2019,103/9 Allies bhavan L.S.C. madangir New delhi-110062,Shiv kumar seth,Director,"011-46184618
9899997809",accounts@kerindiatours.com,Hotel and Tourism related services,,
958,SEPC/02/13/2825/2016-17,Individual Ordinary Members  ,Khaitan & Co LLP,516942859,"1105, Ashoka Estate,24, Barakhamba Road New Delhi-110001",Delhi,31-03-2019,"1105, Ashoka Estate,24, Barakhamba Road New Delhi-110001",Mr. Diptendranath Bhattacharya,Director (Finance),"09810431602
011-41515454",delhi@khaitanco.com,Legal Services,,
959,SEPC/02/13/2791/2016-17,Individual Ordinary Members  ,Kochhar And Co. ,599043296,"Unit No. 1120-21, 11th Floor, Tower-A, DLF Towers, Jasola District Center Jasola Vihar Delhi - 110025'",Delhi,31-03-2019,"Unit No. 1120-21, 11th Floor, Tower-A, DLF Towers, Jasola District Center Jasola Vihar Delhi - 110025'",Mr. Muniraj Bhardwaj,Chief Financial Officer,9958891052,muniraj.bhardwaj@kochhar.com,Legal Services,,
960,SEPC/03/02/2908/2016-17,Institutional/Corporate Members ,Koenig Solutions Limited,502040394,"2nd Floor, Above Cafe Coffee Day KLJ Complex-II, Plot No.70,Opp. Police Station Moti Nagar New Delhi-110015",Delhi,31-03-2019,"2nd Floor, Above Cafe Coffee Day KLJ Complex-II, Plot No.70,Opp. Police Station Moti Nagar New Delhi-110015",Mr. Roahit Agarwal,Director,"011-45007448
9810400646",praveen.chaudhary@koenig-solutions.com ,Educational Services ,,
961,SEPC/03/06/2752/2016-17,Institutional/Corporate Members ,Kuehne (Plus) Nagel Pvt. Ltd. ,504044699,"B-1/1018, Vasant Kunj, New Delhi - 110070",Delhi,31-03-2019,"16/F, DLF Building No. 5, Tower-A, Cyber Terrace, DLF Cyber City, Phase-III, Gurgaon - 122002, Haryana",Mr. Dilip Kohli,Whole Time Director and Company Secretary,"0124-4933911
9810191034",dilip.kohli@kuehne-nagel.com,"Distribution Services 
Maritime Transport Services ",,
962,SEPC/02/13/2889/2016-17,Individual Ordinary Members  ,Lakshmi Kumaran & Sridharan ,504031627,"B-6/10, Safdarjung Enclave New Delhi -110029",Delhi,31-03-2019,"B-6/10, Safdarjung Enclave New Delhi -110029",V. Lakhmikumaran,Partner,"01141299888
9810073131",lakshmikumaran@lakshmisri.com,Legal Services,,
963,SEPC/03/14/2632/2016-17,Institutional/Corporate Members ,Le Passage To India Tours & Travels Private Limited,506020304,"E-29, Hauz Khas New Delhi - 110016",Delhi,31-03-2019,"E-29, Hauz Khas New Delhi - 110016",Mr. Lalit Mehra,Director,"9818068548
0120-3823820",lalit@lpti.in,Hotel and Tourism related Services,,
964,SEPC/03/14/2777/2016-17,Institutional/Corporate Members ,Lotus Trans Travel Private Limited ,589022458,6 A&B Gopala Tower-25 Rajendra Place New Delhi -110008,Delhi,31-03-2019,6 A&B Gopala Tower-25 Rajendra Place New Delhi -110008,Mr. Lajpat Rai,Managing Director,"9811229432
011-25718125
25735073",cmd@lotustranstravels.com,Hotel and Tourism related services  ,,
965,SEPC/02/13/2497/2016-17,Individual Ordinary Members  ,Luthra & Luthra Law Offices,599013575,"103, Ashoka Estate Barakhamba Road, New Delhi - 110001",Delhi,31-03-2019,"103, Ashoka Estate Barakhamba Road, New Delhi - 110001",Mr. Rajiv Krishan Luthra,Proprietor ,"011-41215100
9810006922",rajiv@luthra.com,"Legal Services 
Consultancy Services ",,
966,SEPC/02/13/2493/2016-17,Individual Ordinary Members  ,Luthra & Luthra Law Offices Mumbai ,515932493,"104, Ashoka Estate Barakhamba Road, New Delhi - 110001",Delhi,31-03-2019,"104, Ashoka Estate Barakhamba Road, New Delhi - 110001",Mr. Rajiv Krishan Luthra,Proprietor ,"011-41215100
9810006922",rajiv@luthra.com,Legal Services ,,
967,SEPC/03/14/2653/2016-17,Institutional/Corporate Members ,Micato Tours & Travels Pvt Ltd,501014195,"B-525, Sarita Vihar New Delhi-110044",Delhi,31-03-2019,"B-525, Sarita Vihar New Delhi-110044",Mr. Michael Haidar Ali,Director,"9811255522
011-49433313
",mhaidarali@micato.co.in,Hotel & Tourism Related Services,,
968,SEPC/03/04/2856/2016-17,Institutional/Corporate Members ,Mileage Communications India Pvt. Ltd. ,501042059,"119, Sishan House, 2nd Floor, Shahpur Jat New Delhi - 110049",Delhi,31-03-2019,"119, Sishan House, 2nd Floor, Shahpur Jat New Delhi - 110049",Mr. Sunil Puri,Managing Director,9811153318,puri@mileage.in,Consultancy Services,,
969,SEPC/03/14/2647/2016-17,Institutional/Corporate Members ,NTB Trans (India) Pvt. Ltd. ,503056171,"510-511, Hemkunt Chambers, 89, Nehru Place, New Delhi - 110019",Delhi,31-03-2019,"510-511, Hemkunt Chambers, 89, Nehru Place, New Delhi - 110019",Mr. Arvind Kumar Ranyal,"Managing Director
","011-26472763
9810018611","accounts@ntbluxury.com
ranyalntb@gmail.com
info@ntbluxury.com",Hotel and Tourism related Services,,
970,SEPC/03/14/2564/2016-17,Institutional/Corporate Members ,Paradise Holidays India Pvt. Ltd.,515909076,"312, Ansal Classique Tower Centre, Rajouri Garden, New Delhi - 110027",Delhi,31-03-2019,"312, Ansal Classique Tower Centre, Rajouri Garden, New Delhi - 110027",Mr. Rajnish Kaistha,Director ,"011-45520736, 738
9811052376","india@paradiseholidays.com
",Hotel and Tourism related Services,,
971,SEPC/03/14/2895/2016-17,Institutional/Corporate Members ,Premium Port Lounge Management Company Pvt Ltd,910004625,"Room No.11, Terminal 1D Domestic Departure, IGI Airport Palam New Delhi-110037",Delhi,31-03-2019,"Room No.11, Terminal 1D Domestic Departure, IGI Airport Palam New Delhi-110037",Mr. Prashanth Kumar S,Finance Conteroller,"011-46861094
8527994406",prashanth.satrasala@plaza-network.com,Hotel & Tourism Related Services,,
972,SEPC/03/14/2848/2016-17,Institutional/Corporate Members ,Prime Air Global Limited  ,504049062,"L-8, Green Park Extn. New Delhi -110016",Delhi,31-03-2019,"L-8, Green Park Extn. New Delhi -110016",Mr. Arun Verma,Director,"9810277463
011-46700000",arun@primetravels.com,Hotel and Tourism related services ,,
973,SEPC/03/04/2544/2016-17,Institutional/Corporate Members ,Pythhos Technology Private Limited,512033170,"E-4/3, Vasant Vihar, New Delhi - 1110057",Delhi,31-03-2019,"18th Floor, DLF Building No.5B, DLF Cyber City, Gurgaon - 122002",Mr. Devesh Bahl,Director,"0124-4824900
9971229966",dbahl@bostonanalytics.com,Consultancy Services,,
974,SEPC/03/04/2869/2016-17,Institutional/Corporate Members ,Rabo Equity Advisors Private Limited,515027294,"3rd  Floor D-41 Defence Colony New Delhi 
-110024
",Delhi,31-03-2019,"3rd  Floor D-41 Defence Colony New Delhi 
-110024
",Rahul Rai,Partner and Director/CFO,"01166339840
9717594780",rahul.rai@raboequity.com,Consultnacy Services ,,
975,SEPC/02/07/2762/2016-17,Individual Ordinary Members  ,Rajiv Associates,516991698,"50/8, 1st Floor, Tolstoy Lane, Janpath, New Delhi - 110001",Delhi,31-03-2019,"50/8, 1st Floor, Tolstoy Lane, Janpath, New Delhi - 110001",Mr. Rajiv Kumar Gupta,Partner,"011-43583190
9810113317",rajiv.gupta@rajivassociates.co.in,Accounting/Auditing and Book Keeping Services,,
976,SEPC/02/14/2585/2016-17,Individual Ordinary Members  ,"Sai Voyages (India) 
",515003565,"30/29, IIIrd Floor, East Patel Nagar, New Delhi - 110008",Delhi,31-03-2019,"30/29, IIIrd Floor, East Patel Nagar, New Delhi - 110008",Mr. Ashish Prabhakar,Proprietor ,"011-25757332, 25757333, 9810430587",saivoyages@saivoyagesindia.com,Hotel and Tourism related Services,,
977,SEPC/03/14/2761/2016-17,Institutional/Corporate Members ,Shikhar Travels (India) Pvt. Ltd. ,599012625,"O-47, Basement Lajpat Nagar - II, New Delhi - 110024",Delhi,31-03-2019,"O-47, Basement Lajpat Nagar - II, New Delhi - 110024",Capt. Swadesh Kumar,Managing Director,"011-41322940
41322941
9810024642",swadesh@shikhar.com,Hotel and Tourism related services,,
978,SEPC/03/14/2706/2016-17,Institutional/Corporate Members ,Snowlion Expeditions Private Limited,502002450,"Suite 402 DDA Building-5, District Centre Janakpuri, New Delhi - 110058",Delhi,31-03-2019,"Suite 402 DDA Building-5, District Centre Janakpuri, New Delhi - 110058",Mr. Ashok Koul,Managing Director,"011-25524389
011-25616120
9811046607",ashok@snowlion-india.com,Hotel and Tourism related Services,,
979,SEPC/02/14/2788/2016-17,Individual Ordinary Members  ,State Express ,501021914,"104, 1st Floor, Bhanot House, -17, Community Centre Gulmohar Encalve, New Delhi - 110049",Delhi,31-03-2019,"104, 1st Floor, Bhanot House, -17, Community Centre Gulmohar Encalve, New Delhi - 110049",Mr. Sharat Chandra,Partner ,"011-47674033
9811089932",sharat@statexp.in,Hotel and Tourism related services ,,
980,SEPC/03/14/2601/2016-17,Institutional/Corporate Members ,Swagatam Tours Private Limited ,594029198,"203, Swagatam Chamber, 23-A, Shivaji Marg, Najafgarh Road, Moti Nagar, New Delhi",Delhi,31-03-2019,"203, Swagatam Chamber, 23-A, Shivaji Marg, Najafgarh Road, Moti Nagar, New Delhi",Mr. Pronab Kumar Sarkar,Managing Director ,"011-25444000
9811102111",pronab@swagatamtour.com,Hotel and Tourism related Services,,
981,SEPC/03/02/2691/2016-17,Institutional/Corporate Members ,The Energy And Resources Institute ,588137294,Darbari Seth Block Habitat Place Lodhi Road New Delhi -110003,Delhi,31-03-2019,Darbari Seth Block Habitat Place Lodhi Road New Delhi -110003,Mr. Rangachary Venkateshan,Head Accounts,"011-24682100, 
011-41504900
9899809114",rvenki@teri.res.in,"Educational Services 
Environmental Services 
 Consultancy Services 
",,
982,SEPC/03/14/2623/2016-17,Institutional/Corporate Members ,Tour My India Private Limited,516000110,"A/A-2 1st Floor Shiv Arcade Acharya Niketan Mayur Vihar-1, New Delhi - 110091",Delhi,31-03-2019,"A/A-2 1st Floor Shiv Arcade Acharya Niketan Mayur Vihar-1, New Delhi - 110091",Mr. Vijayendra Thapliyal,Director,"0120-4052615
09810352536",info@tourmyindia.com,Hotel and Tourism related Services,,
983,SEPC/03/14/2536/2016-17,Institutional/Corporate Members ,Travel Spirit International Private Limited ,599029528,"Taneja House, I-184, 2nd Floor, Lajpat Nagar-II, New Delhi - 110024",Delhi,31-03-2019,"218, Splendor Forum Josola District Centre New Delhi - 110025",Mr. Jatinder Pal Singh Taneja,Managing Director,"011-49900900
69400400
9810086560",mdoffice@tsimails.com,Hotel and Tourism related Services,,
984,SEPC/02/14/2875/2016-17,Individual Ordinary Members  ,Truly India Tours & Travels ,516505491,"E-1, Second Floor, Shahpur Jat New Delhi, -110049",Delhi,31-03-2019,"E-1, Second Floor, Shahpur Jat New Delhi, -110049",Mr. Sushil Kumar Gupta ,Partner,"9810036058
011-41754351",sushil@trulyindiatours.com ,Hotel and Tourism related services ,,
985,SEPC/03/14/2678/2016-17,Institutional/Corporate Members ,Uday Tours & Travels Pvt Ltd,501000798,"10/2459, Beadonpura Karol Bagh New Delhi-110005",Delhi,31-03-2019,"10/2459, Beadonpura Karol Bagh New Delhi-110005",Mr. Vinay Marwah,Managing Director,"011-47151500, 9811063133",vinaymarwah@udaytour.com,Hotel & Tourism Related Services,,
986,SEPC/03/04/2520/2016-17,Institutional/Corporate Members ,Unimrkt Research Private Limited,515923729,"Flat No. 632, Royal Residency Plot No. 5, Sector-9, Dwarka, Delhi - 110077",Delhi,31-03-2019,"Flat No. 632, Royal Residency Plot No. 5, Sector-9, Dwarka, Delhi - 110077",Mr. Kanishk Sheel,Director,"9899711160
0124-4245209",kanishk.sheel@unimrkt.com,Consultancy Services,,
987,SEPC/02/04/2473/2016-17,Individual Ordinary Members  ,Vistar Interior LLP,514029391,"Khasra No. 262, The Revenue Estate of Village Saidulajab, Mehrauli, New Delhi - 110030",Delhi,31-03-2019,"Khasra No. 262, The Revenue Estate of Village Saidulajab, Mehrauli, New Delhi - 110030",Ms. Kinty Suri,Designated Partner,"9810165953
011-65001624
011-65001625",kintysuri@yahoo.com,Consultancy Services ,,
988,SEPC/02/13/2789/2016-17,Individual Ordinary Members  ,World Trade Consultants & Advocates,515076643,"14-A, ED Block Madhuban Chowk Pitampura Delhi- 110034",Delhi,31-03-2019,"14-A, ED Block Madhuban Chowk Pitampura Delhi- 110034",Mr. Rajeev Jain,Proprietor,9212575865,rjain@wtcind.com,Legal Services,,
989,SEPC/02/13/2790/2016-17,Individual Ordinary Members  ,WTC Law Offices,516911601,"14-A E D Block, Madhuban Chowk Pitampura Delhi - 110034",Delhi,31-03-2019,"14-A E D Block, Madhuban Chowk Pitampura Delhi - 110034",Mrs Asha jain,Proprietor,"9210475865
011-47037055","asha@wtcind.com
asha_rjain@yahoo.com",Legal Services,,
990,SEPC/03/14/2431/2015-16,Institutional/Corporate Members ,Hi Tours India Private Limited,504047931,"33-34, Regal Building, Parliament Street, New Delhi - 110001",Delhi,31-03-2019,"37, Regal Building, Parliament Street, New Delhi - 110001",Mr. Presm Syal,Director,"011-43424342
9810002647
9891584795",psyal@hi-tours.com,Hotel and Tourism related Services,,
991,SEPC/03/02/2694/2016-17,Institutional/Corporate Members ,ABSAS Solutions Pvt Ltd,515923991,"Flat No- 8349, Sectotr C-8, Vasant Kunj New Delhi- 110070",Delhi,31-03-2019,"Flat No- 8349, Sectotr C-8, Vasant Kunj New Delhi- 110070",Mr. Abhishek Gupta,Director,9650433166,abhishek@absas.net,Educational Services,,
992,SEPC/03/14/1861/2013-14,Institutional/Corporate Members ,Sea & Sky Travel (I) Pvt. Ltd.,501004688,"90/60, Malviya Nagar, New Delhi - 110017",Delhi,31-03-2019,"90/60, Malviya Nagar, New Delhi - 110017",Mr. Shiekh Bashir Ahmed                   ,Managing Director,"011-26685263, 9868270376",bashir@seaandskytravel.com; info@seaandskytravel.com,Hotel and Tourism related Services,,
993,SEPC/02/13/2717/2016-17,Individual Ordinary Members  ,Anand and Anand,596058934,"B-41, Nazamuddin East, New Delhi - 110013",Delhi,31-03-2019,"B-41, Nazamuddin East, New Delhi - 110013",Mr. Safir Anand,Partner,9811297452,safir@anandandanand.com,Legal Services,,
994,SEPC/02/13/2445/2015-16,Individual Ordinary Members  ,Link Legal ,515065536,"Thapar House, Central Wing, 1st Floor, 124, Janpath, New Delhi - 110001",Delhi,31-03-2019,"Thapar House, Central Wing, 1st Floor, 124, Janpath, New Delhi - 110001",Mr. Atul Sharma,Partner,"011-46511000
9811055984",linklegal@linklegal.in,Legal Services,,
