639,SEPC/03/04/2697/2016-17,Institutional/Corporate Members ,Molex India Business Services Private Limited ,714016004,"Plot No. 6(A), Sadaramangala Indl. Area Kadugodi, Bangalore - 560067, Karnataka",Karnataka,31-03-2019,"Plot No. 6(A), Sadaramangala Indl. Area Kadugodi, Bangalore - 560067, Karnataka",Mr. Sripadu V,Manager-Commercial ,"080-41293591
9900051080",ssripadu@molex.com,Consultancy Services,,
640,SEPC/03/07/2730/2016-17,Institutional/Corporate Members ,Pierian Services Private Limited ,703005693,"979, 13 Cross 19 Main BSK II Stage Bangalore - 560027, Karnataka",Karnataka,31-03-2019,"At 110/6, Lalbagh Road Cross, Krishnappa Layout, Bangalore - 560027, Karnataka",Mr. Gurunath N Kanathur,Director,9620839528,rekha.s@pierianservices.com,Accounting/Auditing and book keeping services; ,,
641,SEPC/02/14/2879/2016-17,Individual Ordinary Members  ,Pushpam Realty,712001069,"No.191, 1st Cross, Byarasandra 1st Block East Jyanagar Bangalore- 560011 (Karnataka)",Karnataka,31-03-2019,"No.29, Old No. 416, 35th Cross , 18th Main Road, Jayanagar Bangalore - 560041",Ms. Veena R.S,Managing Partner,"080-40902405, 7760988239","veena@pushpamgroup.in
abhiram@pushpamgroup.in",Hotel & Tourism Related Services,,
642,SEPC/03/04/2876/2016-17,Institutional/Corporate Members ,Te Connectivity India Private Limited ,793017505,"Te Park Siteno 22B Doddenakundi 2nd, Indlarea Whitefield Road MahadevapuBangalore -560048  (Karnataka)",Karnataka,31-03-2019,"Te Park Siteno 22B Doddenakundi 2nd, Indlarea Whitefield Road MahadevapuBangalore -560048  (Karnataka)",Mr. Sunil Rawat,Director,"08033195000
09845181068",sunil@te.con,"Consultancy Services
 Marketing Research and Public Opinion Polling Services/Management Services
 Legal Services
 Distribution Services
",,
643,SEPC/03/01/1549/2012-13,Institutional/Corporate Members ,Manipal Health Enterprises Private Limited,710014821,"#98/2, Rustom Bagh off Hal Airport Road, Bangalore - 560017, Karnataka",Karnataka,31-03-2019,"#98/2, Rustom Bagh off Hal Airport Road, Bangalore - 560017, Karnataka",Mr. T. Romoji                                       ,CFO and Company Secy. ,"080-49360313                          09945637450
09900511667",t.ramoji@manipalhospitals.com; sonal.pahwa@manipalhospitals.com,"Healthcare services including services by nurses, physiotherapist and paramedical personnel ",,
644,SEPC/03/01/2506/2016-17,Institutional/Corporate Members ,Infosense Technologies Private Limited,701006102,"No. 27/A, 3rd Floor, Boopasandra Main Road, Boopasandra, Bangalore - 560094, Karnataka",Karnataka,31-03-2019,"No. 27/A, 3rd Floor, Boopasandra Main Road, Boopasandra, Bangalore - 560094, Karnataka",Mr. Sanjeev Patel,Director,9845003748,sp@sanj.co,"Healthcare Services including services by nurses, physiotherapist and paramedical personnel
Accounting/Auditing and Book Keeping Services",,
645,SEPC/03/14/1415/2011-12,Institutional/Corporate Members ,Karnataka Golf Association,798011190,"No. 1, Golf Avenue Kodhihalli, Off Airport Road, Bangalore – 560008, Karnataka",Karnataka,31-03-2019,"No. 1, Golf Avenue Kodhihalli, Off Airport Road, Bangalore – 560008, Karnataka",Mr. Sandeep Madhavan. R,Finance Manager ,"080-40090018, 7259563959","secretary@kga.in
accounts@kga.in,
finance@kga.in; ",Hotel and Tourism related Services,,
646,SEPC/03/07/2557/2016-17,Institutional/Corporate Members ,GCC Services India Pvt. Ltd. ,715005502,"Peridot Block, 12th and 13th Floor, Bagmane World Technology Centre SEZ, KR Puram- Marathalli Ring Road, Bangalore - 560048, Karnataka",Karnataka,31-03-2019,"Peridot Block, 12th and 13th Floor, Bagmane World Technology Centre SEZ, KR Puram- Marathalli Ring Road, Bangalore - 560048, Karnataka",Mr. Subrahmanyam Rachakonda,Director,"0124-4681560
9666244244",r.subrahmanyam@in.abinbev.com ,"Accounting/Auditing and Book Keeping Services
Consultancy Services",,
647,SEPC/03/11/2407/2015-16,Institutional/Corporate Members ,Esko Graphics India Private Limited,708007546,"Easteem Tower, No. 71, Railway Parallel Road, Kumara Park West Bangalore - 560020, Karnataka",Karnataka,31-03-2019,"Easteem Tower, No. 71, Railway Parallel Road, Kumara Park West Bangalore - 560020, Karnataka",Mr. Mohan Kumar Srinivasa,Business Controller,"080-43520100
9845123113",mohankumar.srinivasa@esko.com,Marketing Research and Public Opinion Polling Services/Management Services,,
648,SEPC/02/13/2793/2016-17,Individual Ordinary Members  ,Krishnamurthy & Co.,715030515,"Prestige Takt No. 23, 4th Floor, Kasturba Road, Bangalore - 560001, Karnataka",Karnataka,31-03-2019,"Prestige Takt No. 23, 4th Floor, Kasturba Road, Bangalore - 560001, Karnataka",Mr. Vinay Prabhakar Ulpe,Finance Director,"022-67492595
9820505010",vinay.ulpe@klaw.in,Legal Services,,
649,SEPC/03/04/3318/2017-18,Institutional/Corporate Members ,Andritz Technologies Private Limited,798011319,3rd Floor Magnolia Manyata Embassy Business Park Hebbal Bangalore Karnataka -560045,Karnataka,31-03-2019,3rd Floor Magnolia Manyata Embassy Business Park Hebbal Bangalore Karnataka -560045,Mr. Gopalan Sridhar,Executive Director ,"044-42939393
09840022165",gopalan.sridhar@andritz.com,Consultancy Services; Architectural Services and related services; Accounting/Auditing and Book Keeping Services;  Marketing Research and Public Opinion Polling Services/Management Services,,
650,SEPC/03/11/3039/2017-18,Institutional/Corporate Members ,Blueocean Market Intelligence Services Private Limited ,710028580,"Embassy Tech Village Building 2A,Lower Ground Floor Marthahalli-Sarjapur Outer Ring RoadBangalore -560103 ( Karnataka)",Karnataka,31-03-2019,"Embassy Tech Village Building 2A,Lower Ground Floor Marthahalli-Sarjapur Outer Ring RoadBangalore -560103 ( Karnataka)",Mr. Neeraj Jain,Financial Controller,9821875678,neeraj.jain@cross-tab.com,Marketing Research and Public Opinion Polling Services/Management Services,,
651,SEPC/03/04/3415/2017-18,Institutional/Corporate Members ,Exdion Solutions Private Limited,716924579,No.7 / A STC Trade Centre 5th Floor Nandini Layout  Bangalore -560096 (Karnataka),Karnataka,31-03-2019,No.7 / A STC Trade Centre 5th Floor Nandini Layout  Bangalore -560096 (Karnataka),Mr. Maruthesh A,Sr. Manager Finance,"08046585012
09986631186",finance@edxion.com,Consultancy Services ,,
652,SEPC/03/10/3308/2017-18,Institutional/Corporate Members ,Gale Creative Agency Private Limited,AAFCG9657B,"No. 3/1, Ground Floor, JP Techno Park, Miller Tank Bund Road, Vasanth Nagar Bangalore - 560052, Karnataka",Karnataka,31-03-2019,"No. 3/1, Ground Floor, JP Techno Park, Miller Tank Bund Road, Vasanth Nagar Bangalore - 560052, Karnataka",Mr. Sanjay Krishnamurthy,Director,"9740084430
9945223103",sanjay@galepartners.com,"Advertising Services
Marketing Research and Public Opinion Polling Services/Management Services",,
653,SEPC/02/01/2923/2017-18,Individual Ordinary Members  ,HCG Manavata Oncology LLP,716506475,"HCG Tower No. 8, Sampangirram Nagar, Bangalore - 560018, Karnataka",Karnataka,31-03-2019,"HCG Tower No. 8, Sampangirram Nagar, Bangalore - 560018, Karnataka",Mr. Venkatesan N,General Manager-S C M,"080-46607711
9591699227",venkatesan.n@hcgoncology.com,"Healthcare Services including services by Nurses, Physiotherapist and paramedical personnel",,
654,SEPC/03/04/3058/2017-18,Institutional/Corporate Members ,Meritor Commercial Vehicle Systems India Private Limited,708018955,"Tower 1 Block Ii Global Village,Pattangere Village Mylasandra Bangalore-560059 (Karnataka)",Karnataka,31-03-2019,"Tower 1 Block Ii Global Village,Pattangere Village Mylasandra Bangalore-560059 (Karnataka)",Mr. Jeevan Balasubramanian ,Director,"080-43574100;
08095504332",jeevan.balasubramanian@meritor.com,Consultancy Services  ,,
655,SEPC/03/04/3399/2017-18,Institutional/Corporate Members ,Oplus Mobitech India Private Limited,715900951,"Hira Building, Municipal No.New 21, 3, Ward 76, Richmond TN, Pid No.76-10-2 Brigade Road Bangalore -560001 (Karnataka)",Karnataka,31-03-2019,"Hira Building, Municipal No.New 21, 3, Ward 76, Richmond TN, Pid No.76-10-2 Brigade Road Bangalore -560001 (Karnataka)",Mr. Vikash Agarwal,Director,"080-65300523
07090252255",oplusfinance.india@oneplus.net,Consultancy Services     ,,
656,SEPC/03/07/3341/2017-18,Institutional/Corporate Members ,Prodat IT Solutions India Private Limited,704018454,No. 74 & 75 24th Main 2nd Phase 3rd Cross  J. P. Nagar Bangalore -560078 (Karnataka),Karnataka,31-03-2019,No. 74 & 75 24th Main 2nd Phase 3rd Cross  J. P. Nagar Bangalore -560078 (Karnataka),Mr. Khalid Mushtaq Mohammed,Director,"08041217158
09880711880",khalid@prodatit.co.uk,Accounting/Auditing and Book keeping Services,,
657,SEPC/03/10/3124/2017-18,Institutional/Corporate Members ,Stirred Creative Advertising Private Limited ,713020644,"No.87, Spencers Roa Frazer Town Bangalore -560005 (Karnataka)",Karnataka,31-03-2019,"No.87, Spencers Roa Frazer Town Bangalore -560005 (Karnataka)",Mr. Alex William Anthony,Managing Director,"080-25306005; 6006;
09880784248",alex@stirredcreative.in ,Advertising Services ,,
658,SEPC/03/09/3277/2017-18,Institutional/Corporate Members ,Kintesu World Express India Pvt. Ltd. ,797014292,"Brigade Magnum, B-102, First Floor, Amruthhalli Kodighalli Gate Hebb Bangalore - 560092, Karnataka",Karnataka,31-03-2019,"Brigade Magnum, B-102, First Floor, Amruthhalli Kodighalli Gate Hebb Bangalore - 560092, Karnataka",Mr. Karthi Baskar,Director,"080-30054500
9902874747","karthi.baskar@kwe.com
gajanana.bhat@kwe.com",Maritime Transport Services ,,
659,SEPC/03/07/3521/2018-19,Institutional/Corporate Members ,Pradot Technologies Private Limited,702000230,"3 And 4 Floor Of Nd Fusionmall No73, 74, 113 &144 16th Main Btm Layout 2sta Bangalore-560076 (Karnataka)",Karnataka,31-03-2019,"3 And 4 Floor Of Nd Fusionmall No73, 74, 113 &144 16th Main Btm Layout 2sta Bangalore-560076 (Karnataka)",Mr. Venkata Ramana Rao,Finance Controller,"08067300200
09900591215",venkat.rao@g1hs.com,Accounting/Auditing and Book Keeping Services,,
660,SEPC/03/04/3522/2018-19,Institutional/Corporate Members ,VMWARE Software India Private Limited ,707022738,"Kalyani Magnum Tower-1, 3rd Floor No. 165/2,  Doraisanipalya, Iim Post Bangalore -560076 (Karnataka)",Karnataka,31-03-2019,"Kalyani Magnum Tower-1, 3rd Floor No. 165/2,  Doraisanipalya, Iim Post Bangalore -560076 (Karnataka)",Mr. Bosco Santiago Noronha ,Director,"08067147251
",bnoronha@vmware.com,Consultancy Services ,,
661,SEPC/03/07/3529/2018-19,Institutional/Corporate Members ,OG Plus Services Private Limited ,716914352,"No.27/A, 3rd Floor Above Sbm Booasandra Main Road Boopasandra Bangalore -560094 (Karnataka)",Karnataka,31-03-2019,"No.27/A, 3rd Floor Above Sbm Booasandra Main Road Boopasandra Bangalore -560094 (Karnataka)",Mr. Sanjeev Patel,Director,"080-23417077
09848009748",sp@sanj.co,Accounting/Auditing and Book Keeping Services,,
662,SEPC/03/14/3543/2018-19,Institutional/Corporate Members ,Brigade Hotel Ventures Limited,AAGCB8612G,"29th & 30th Floor Wtc Brigade Gate Way 26/1, Dr. Rajkumar Road Malleswaram Bangalore -560055 (Karnataka)",Karnataka,31-03-2019,"29th & 30th Floor Wtc Brigade Gate Way 26/1, Dr. Rajkumar Road Malleswaram Bangalore -560055 (Karnataka)",Mr. Vineet Verma,Director,"08041379200
09880405369",vineet@brigadegroup.com,Hotel and Tourism related services   ,,
663,SEPC/03/04/3565/2018-19,Institutional/Corporate Members ,Eurofins IT Solutions India Private Limited,712029214,"No.540/1, 2nd Floor Doddanekundi Indl. Area, 2, Hoody Whitefield Bangalore -560048 (Karnataka)",Karnataka,31-03-2019,"No.540/1, 2nd Floor Doddanekundi Indl. Area, 2, Hoody Whitefield Bangalore -560048 (Karnataka)",Mr. Sanjeev Khatri,Managing Director,08-30706666,sanjeevkhatri@eurofins.com,Consultancy Services  ,,
664,SEPC/02/04/3594/2018-19,Individual Ordinary Members  ,ES And AB Consultants ,AUZPS6300C,"No. 299,10th Cross 1st Block Begur Road Vishwapriya Nagar Bangalore -560068 (Karnataka)",Karnataka,31-03-2019,"No. 299,10th Cross 1st Block Begur Road Vishwapriya Nagar Bangalore -560068 (Karnataka)",Mr. Munusamy Shankarrao ,Proprietor,7259884219,shankarrao.munusamy@gmail.com,Consultancy Services ,,
665,SEPC/03/01/3620/2018-19,Institutional/Corporate Members ,Logixhealth Solutions Private Limited ,714017442,GroundFloor Pebble Beach Egl Business Park Kormanagala Inner Ring Road Varthur Hobli Bangalore -560071 (Karnataka),Karnataka,31-03-2019,GroundFloor Pebble Beach Egl Business Park Kormanagala Inner Ring Road Varthur Hobli Bangalore -560071 (Karnataka),Mr. Amit Kumar ,Director,7406030000,ajaiswal@logixhealth.com,"Healthcare services including services by nurses, physiotherapist and paramedical personnel  ",,
666,SEPC/03/04/3623/2018-19,Institutional/Corporate Members ,Annet Systems Private Limited ,"0715902652
     
",Cloud 9 Villa No 125 3rd Cross Bom Masandra Industrial Area Bangalore -560099 (Karnataka),Karnataka,31-03-2019,Cloud 9 Villa No 125 3rd Cross Bom Masandra Industrial Area Bangalore -560099 (Karnataka),Mr. Natarajan Suresh Kumar ,Director,9845055628, nsk72@yahoo.com,Consultancy Services  ,,
667,SEPC/03/04/3666/2018-19,Institutional/Corporate Members ,Zynom Technologies Private Limited ,717507726,No. 35 1 2nd Floor Ramagondana Halli Whitefield  Bangalore -560066 ( Karnataka),Karnataka,31-03-2019,No. 35 1 2nd Floor Ramagondana Halli Whitefield  Bangalore -560066 ( Karnataka),Mr. Vikas Kumar Chouhan ,Director,9663011557,vikas@zynom.com,Consultancy Services  ,,
668,SEPC/03/01/3699/2018-19,Institutional/Corporate Members ,Health Care Process Solutions (India) Private Limited,708016308,"HCG Towers-1, #8 P. Kalinga Rao Road, Sampangiram Nagar Bangalore-560027 (Karnataka)",Karnataka,31-03-2019,"HCG Towers-1, #8 P. Kalinga Rao Road, Sampangiram Nagar Bangalore-560027 (Karnataka)",Mr. M. P. Karthikeyan,General Manager,"080-40206231
09448110301",kmp@healthcareglobal.net,"Healthcare services including services by nurses, physiotherapist and paramedical personnel",,
669,SEPC/03/04/3720/2018-19,Institutional/Corporate Members ,Lafiny Technologies Private Limited,715011847,Shetty Compound No 240 3rd Block 4th Stage 7th D Main Basaveshwarnaga Bangalore-560079 (Karnataka),Karnataka,31-03-2019,Shetty Compound No 240 3rd Block 4th Stage 7th D Main Basaveshwarnaga Bangalore-560079 (Karnataka),Ms. Shobha M. S.,Director,7760138139,accounts@lafiny.com,Consultancy Services ,,
670,SEPC/03/10/3813/2018-19,Institutional/Corporate Members ,Foretell Business Solutions Private Limited ,AAACF4355J,146 Gopal Towers 1st Floor Ramaiah ST Old Airport Road Kodihalli Bangalore-560008 (Karnataka),Karnataka,31-03-2019,146 Gopal Towers 1st Floor Ramaiah ST Old Airport Road Kodihalli Bangalore-560008 (Karnataka),Mr. Srivastava G.,Director,"080-25276152
09341264341",gsv@fbspl.com; srikanth@fbspl.com,Advertising Services; Consultancy Services; Printing & Publishing Services; Other Services (Convention Services),,
671,SEPC/03/11/3907/2018-19,Institutional/Corporate Members ,EMC IT Solutions India Private Limited,713003910,"The Millenia 2nd Floor Tower B, No 1 And 2 Murphy Road Ulsoor Bangalore Karnataka -560008",Karnataka,31-03-2019,"KC.XXV/812, Srivalsam Thevally. P.O. Kollam Kerala  -691009",Mr. Anil Jain,Authorised Signatory,"080-66908888
09845260043",ANIL.JAIN@EMC.COM,Marketing Research and Public Opinion Polling Services/Management Services,,
672,SEPC/03/07/3915/2018-19,Institutional/Corporate Members ,Guitcom Consulting Private Limited ,713005611,"Jupiter -1, 30-1, 4th Cross 7th Block Jayanagar West  Bangalore -560070 (Karnataka)",Karnataka,31-03-2019,"Jupiter -1, 30-1, 4th Cross 7th Block Jayanagar West  Bangalore -560070 (Karnataka)",Ms. Anuradha Vaidyeswar ,Director,"080-30134200
09845192027",anuradha@guitcom.com,Accounting/Auditing and book keeping services ,,
673,SEPC/03/14/3923/2018-19,Institutional/Corporate Members ,Aqua Creed Private Limited  ,706013522,"No.112 C The Elgin No 11,Hosur Road  Bangalore- 560025 (Karnataka)",Karnataka,31-03-2019,"No.112 C The Elgin No 11,Hosur Road  Bangalore- 560025 (Karnataka)",Mr. Darran Geoffery Davis,Dircetor,9900568091,darran.davis75@gmail.com,Hotel and Tourism related services ,,
674,SEPC/03/14/222/2008,Institutional/Corporate Members ,Amethyst Hospitality (P) Ltd.,707021502,"Davanam Plaza, Opposite Madiwala Police Station, Hosur Main Road, Bangalore - 560068",Bangalore,31-03-2019,"Mazdiwala Commercial Plaza, Opposite Madiwala Police Station, Hosur Main Road, Bangalore - 560068",Mr. Harish Davanam                                ,Director ,"9980333555,                        
080-41418105
080-41418181","harishdavanam@gmail.com
fc@davanamsarovarportico.com",Hotel and Tourism related services ,,
675,SEPC/03/14/255/2008,Institutional/Corporate Members ,Brigade Enterprises Limited,799016411,"29th & 30th Floor, World Trade Centre, Brigade Gateway Campus, 26/1, Rajkumar Road Malleswaram Bangalore – 560055",Bangalore,31-03-2019,"29th & 30th Floor, World Trade Centre, Brigade Gateway Campus, 26/1, Rajkumar Road Malleswaram Bangalore – 560055",Mr. M. R. Jaishankar                                      ,Chairman and Managing Director ,"080- 41379200
09880405369
","jaishankar@brigadegroup.com
",Hotel and Tourism related services ,,
676,SEPC/03/14/242/2008,Institutional/Corporate Members ,Brigade Hospitality Services Limited (Formerly - Brigade Hospitality Services Private Limited),705016901,"29th Floor World Trade Centre Brigade Gateway Campus, 26/1, Rajkumar Road, Malleswaram Bangalore - 560055",Bangalore,31-03-2019,"29th Floor World Trade Centre Brigade Gateway Campus, 26/1, Rajkumar Road, Malleswaram Bangalore - 560055",Mr. Vineet Verma,Executive Director,"               080-40438000
09880405369",vineet@brigadegroup.com,Hotel and Tourism related services ,,
677,SEPC/03/14/80/2008,Institutional/Corporate Members ,Paul Resorts & Hotels Private Limited (formerly - Bloomingdale Hotels Pvt. Ltd.),705017702,"“#139/28, 3rd Main, Amarjyothi West Winig, Domlur layout, Bangalore - 560071",Bangalore,31-03-2019,"139/28, 3rd Main West Wing, Amarjyothi Layout, Domlur, Bangalore – 560071",Mr. Mohammed Ali N.                              ,DIRECTOR,"080-40477777,                 09902010388","accountsblr@thepaul.in
",Hotel and Tourism related services ,,
678,SEPC/03/14/51/2008 ,Institutional/Corporate Members ,Prestige Estates Projects Ltd. (formerly -  Prestige Estates Projects Private Ltd.) ,703001451,"The Falcon House, 2nd Floor, No. 1, Main Guard Cross Road, Bangalore - 560001",Bangalore,31-03-2019,"The Falcon House, 2nd Floor, No. 1, Main Guard Cross Road, Bangalore - 560001",Mr. Irfan Razack                            ,CMD,"080-25001296, 9945332412
",irfan@prestigeconstructions.com; ,Hotel and Tourism related services ,,
679,SEPC/03/14/196/2008,Institutional/Corporate Members ,Siddharta Resorts & Foods Pvt. Ltd.,705001890,"17/6, Ali Askar Road, Cunningham Road, Bangalore - 560052. ",Bangalore,31-03-2019,"295, Maha Rana Pratap Simha Road, Opp. Horse Park, Nazarbad, Mysore - 570010",Mr. P.G. Tharun Kumar,Managing Director,"09980061057,                       
0821-2522500/600","vp.finance@thewindflower.com
",Hotel and Tourism related services ,,
680,SEPC/03/14/228/2008,Institutional/Corporate Members ,Sri Sapthagiri Srinivasa Enterprises Pvt. Ltd.  ,706001770,"No. 619/G, 36th Cross, 2nd Block, Rajajinagar, Bangalore – 560010",Bangalore,31-03-2019,"No. 619/G, 36th Cross, 2nd Block, Rajajinagar, Bangalore – 560010",Mr. G. Dayanand                                            ,Managing Director ,"080-40443636
9632353305",saravana.m@gdhotels.in,Hotel and Tourism related services ,,
681,SEPC/03/14/61/2008 ,Institutional/Corporate Members ,"Velankani Information Systems Limited
(Formerly - Velankani Information Systems Private Limited) ",702000728,"43, Electronics City, Phase -II, Hosur Road, Bangalore - 560100",Bangalore,31-03-2019,"43, Electronics City, Phase -II, Hosur Road, Bangalore - 560100",Mr. Kiron D Shah                                        ,Managing Director ,"09880846199,                                                        080-66145807, 66145809",kshah@velankanigroup.com; skswamy@velankanigroup.com,Hotel and Tourism related services ,,
682,SEPC/03/14/742/2009,Institutional/Corporate Members ,Adarsh Realty & Hotels Pvt. Ltd.     ,703017942,"NO. 10, Vittal Mallya Road, Bangalore - 560001",Bangalore,31-03-2019,"NO. 10, Vittal Mallya Road, Bangalore - 560001",Mr. B.M. Karunesh                                     ,Director ,"080-41343300
9900342011
","suresh.kumar@adarshdevelopers.com
rajiv@adarshdevelopers.com",Hotel and Tourism Related Sevices,,
683,SEPC/03/01/613/2009,Institutional/Corporate Members ,Imperial Hospital & Research Center Ltd. ,702005649,"154/11, Bhannergatta Road, Opp. Indian Institute of Management, Bangalore - 560076",Bangalore,31-03-2019,"154/11, Bhannergatta Road, Opp. Indian Institute of Management, Bangalore - 560076",Mr. Palaparambil Kurian Davison,Chief Executive Officer ,"080-26304500
9632449000","davison_p@apollohospitals.com
abubakker_s@apollohospitals.com","Healthcare Services including services by Nurses, Physiotherapist and paramedical personnel",,
684,SEPC/03/14/766/2009,Institutional/Corporate Members ,Mysore Intercontinental Hotels Pvt. Ltd.     ,705026850," No. 219/11, 3rd & 4th Floor, Bellary Road, Sadhashivanagar,                         Bangalore - 560080",Bangalore,31-03-2019," No. 219/11, 3rd & 4th Floor, Bellary Road, Sadhashivanagar,                         Bangalore - 560080",Mr. J.P. Sudhakar                         ,Director ,"                080-42440044
080-42440052
9343642888
9060419319","banking@jp-group.co.in
director@jp-group.co.in
corpfinance@gmail.com",Hotel and Tourism Related Services,,
685,SEPC/03/14/570/2009,Institutional/Corporate Members ,St. Marks Hotels Pvt. Ltd.,793006091,"No. 4/1, St. Marks Road, Bangalore - 560001",Bangalore,31-03-2019,"No. 4/1, St. Marks Road, Bangalore - 560001",Mr. Lalchand B. Dadlani                                   ,Director,"080-40019000, Extn: 8110/8111                  
9845016060
",accounts@stmarkshotel.com,Hotel and Tourism related services ,,
686,SEPC/03/04/1164/2010-11,Institutional/Corporate Members ,Advinus Therapeutics Limited  ,705008690,"No. 21 & 22, Phase II, Peenya Industrial Area,                                     Bangalore – 560058.",Bangalore,31-03-2019,"No. 21 & 22, Phase II, Peenya Industrial Area,                                     Bangalore – 560058.",Mr. Rajiv Malik,CEO & MD,"080-28394959
9741550350",rajiv.malik@advinus.com,Consultancy Services ,,
687,SEPC/03/01/923/2010-11,Institutional/Corporate Members ,Healthcare Global Enterprises Ltd.,798010789,"HCG Towers, No. 8, P. Kalinga Rao Road, Sampangiram Nagar, Bangalore – 560027",Bangalore,31-03-2019,"HCG Towers, No. 8, P. Kalinga Rao Road, Sampangiram Nagar, Bangalore – 560027",Mr. Venkaesan N.,General Manager - SCM,"080-46607711
9591699227
","venkatesan.n@hcgoncology.com
dm@hchoncology.com","Healthcare services including services by nurses, physiotherapist and paramedical personnel ",,
688,SEPC/03/01/1175/2010-11,Institutional/Corporate Members ,Shiva & Shiva Orthopaedic Hospital Private Limited    ,705012727,"No. 29/P2, Narayana Health City, Hosur Road, Bommasandra, Bangalore – 560099",Bangalore,31-03-2019,"Sparsh Hospital No. 146, Infantry Road, Bangalore - 560001",Dr. Sharan Shivaraj Patil                                   ,Managing Director ,"080-33282102
7353054757",madhu@sparshhospital.com; drsharanpatil@sparshhospital.com; ,"Healthcare Services including services by nurses, physiotherapist and paramedical personnel    ",,
689,SEPC/03/14/1056/2010-11,Institutional/Corporate Members ,Suraj Inn Private Limited,710014678,"Mantri House, # 41 Vittal Mallya Road, Bangalore - 560001",Bangalore,31-03-2019,"Mantri House, # 41 Vittal Mallya Road, Bangalore - 560001",Mr. H.S. Girish Gupta                  ,Director ,"9845107374
080-41345076","girish.gupta@mantri.in
",Hotel and Tourism related Services  ,,
690,SEPC/03/14/1434/2011-12,Institutional/Corporate Members ,Cessna Garden Developers Private Limited,706018010,"The Falcon House, No. 1, Main Guard Cross Road, Bangalore - 560001",Bangalore,31-03-2019,"The Falcon House, No. 1, Main Guard Cross Road, Bangalore - 560001",Mrs. Badrunissa Irfan                       ,Director ,"080-25001296, 9945332412","rprasanna@prestigeconstructions.com
faizalam.ansari@alofthotels.com",Hotel and Tourism related Services,,
691,SEPC/03/14/1377/2011-12,Institutional/Corporate Members ,Red Apple Kitchen Consultancy Pvt. Ltd.,707027781,"No. 302, 3rd Floor, House of Lords, St. Marks Road, Bangalore - 560001",Bangalore,31-03-2019,"No. 302, 3rd Floor, House of Lords, St. Marks Road, Bangalore - 560001",Mr. Goudhaman Balasubramanian                                 ,Director ,"080-41738492
9886560268
9845553106","corporateaccounts@toscano.co.in
goutham_b@yahoo.com",Hotel and Tourism related Services ,,
692,SEPC/03/01/1868/2013-14,Institutional/Corporate Members ,Soukya Indian Holistic Health Centre Pvt. Ltd. ,707018129,"202, Parvathi Plaza, 105, Richmond Circle,                     Bangalore - 560025 ",Bangalore,31-03-2019,"Soukya Road, Samethanahalli, Whitefield, Bangalore - 560067",Dr. Issac Mathai                                   ,Managing Director,"080-2801700-08, 9845007800
","drmathai@soukya.com
accounts@soukya.com","Healthcare services including services by nurses, physiotherapist and paramedical personnel",,
